<?xml version="1.0" encoding="UTF-8"?>
<gn:gn xmlns:fn="http://www.w3.org/2005/xpath-functions" xmlns:gn="http://www.clbme.bas.bg/GN" xmlns:pregn="http://www.clbme.bas.bg/GN-UML-Intermediate" xmlns:uml="http://schema.omg.org/spec/UML/2.0" xmlns:umlfn="http://www.clbme.bas.bg/UML2GNFunctions" xmlns:xhtml="http://www.w3.org/1999/xhtml" xmlns:xmi="http://schema.omg.org/spec/XMI/2.1" xmlns:xs="http://www.w3.org/2001/XMLSchema" xmlns:xsi="http://www.w3.org/2001/XMLSchema-instance" xsi:schemaLocation="http://www.clbme.bas.bg/GN GNschema.xsd" name="VideoApplicationSendFrame">
  <gn:transitions>
    <gn:transition id="_11_5_3afb06b6_1155040964093_170047_129" name="vs" positionX="350" positionY="160" sizeY="60">
      <gn:inputs>
        <gn:input ref="_11_5_3afb06b6_1155041001640_595795_154">
          <gn:arc>
            <gn:point positionX="340" positionY="170" />
            <gn:point positionX="350" positionY="170" />
          </gn:arc>
        </gn:input>
        <gn:input ref="_11_5_3afb06b6_1155040964093_170047_129_LocalMemory">
          <gn:arc>
            <gn:point positionX="375" positionY="200" />
            <gn:point positionX="385" positionY="200" />
            <gn:point positionX="385" positionY="230" />
            <gn:point positionX="315" positionY="230" />
            <gn:point positionX="315" positionY="200" />
            <gn:point positionX="350" positionY="200" />
          </gn:arc>
        </gn:input>
      </gn:inputs>
      <gn:outputs>
        <gn:output ref="_11_5_3afb06b6_1155041008937_456743_160">
          <gn:arc>
            <gn:point positionX="350" positionY="170" />
            <gn:point positionX="365" positionY="170" />
          </gn:arc>
        </gn:output>
        <gn:output ref="_11_5_3afb06b6_1155040964093_170047_129_LocalMemory">
          <gn:arc>
            <gn:point positionX="350" positionY="200" />
            <gn:point positionX="365" positionY="200" />
          </gn:arc>
        </gn:output>
      </gn:outputs>
      <gn:predicates>
        <gn:predicate input="_11_5_3afb06b6_1155040964093_170047_129_LocalMemory" output="_11_5_3afb06b6_1155040964093_170047_129_LocalMemory">true</gn:predicate>
        <gn:predicate input="_11_5_3afb06b6_1155041001640_595795_154" output="_11_5_3afb06b6_1155041008937_456743_160">delay</gn:predicate>
      </gn:predicates>
    </gn:transition>
    <gn:transition id="_11_5_3afb06b6_1155040964093_303373_131" name="vp" positionX="480" positionY="190" sizeY="60">
      <gn:inputs>
        <gn:input ref="_11_5_3afb06b6_1155041008937_456743_160">
          <gn:arc>
            <gn:point positionX="375" positionY="170" />
            <gn:point positionX="450" positionY="170" />
            <gn:point positionX="450" positionY="200" />
            <gn:point positionX="480" positionY="200" />
          </gn:arc>
        </gn:input>
        <gn:input ref="_11_5_3afb06b6_1155040964093_303373_131_LocalMemory">
          <gn:arc>
            <gn:point positionX="505" positionY="230" />
            <gn:point positionX="515" positionY="230" />
            <gn:point positionX="515" positionY="260" />
            <gn:point positionX="445" positionY="260" />
            <gn:point positionX="445" positionY="230" />
            <gn:point positionX="480" positionY="230" />
          </gn:arc>
        </gn:input>
      </gn:inputs>
      <gn:outputs>
        <gn:output ref="_11_5_3afb06b6_1155041117734_626168_171">
          <gn:arc>
            <gn:point positionX="480" positionY="200" />
            <gn:point positionX="495" positionY="200" />
          </gn:arc>
        </gn:output>
        <gn:output ref="_11_5_3afb06b6_1155040964093_303373_131_LocalMemory">
          <gn:arc>
            <gn:point positionX="480" positionY="230" />
            <gn:point positionX="495" positionY="230" />
          </gn:arc>
        </gn:output>
      </gn:outputs>
      <gn:predicates>
        <gn:predicate input="_11_5_3afb06b6_1155040964093_303373_131_LocalMemory" output="_11_5_3afb06b6_1155040964093_303373_131_LocalMemory">true</gn:predicate>
        <gn:predicate input="_11_5_3afb06b6_1155041008937_456743_160" output="_11_5_3afb06b6_1155041117734_626168_171">delay</gn:predicate>
      </gn:predicates>
    </gn:transition>
    <gn:transition id="_11_5_3afb06b6_1155040969250_32393_150" name="vw" positionX="80" positionY="100" sizeY="90">
      <gn:inputs>
        <gn:input ref="_11_5_3afb06b6_1155041117734_626168_171">
          <gn:arc>
            <gn:point positionX="505" positionY="200" />
            <gn:point positionX="515" positionY="200" />
            <gn:point positionX="515" positionY="70" />
            <gn:point positionX="50" positionY="70" />
            <gn:point positionX="50" positionY="110" />
            <gn:point positionX="80" positionY="110" />
          </gn:arc>
        </gn:input>
        <gn:input ref="_11_5_3afb06b6_1155041130125_346459_182">
          <gn:arc>
            <gn:point positionX="105" positionY="170" />
            <gn:point positionX="115" positionY="170" />
            <gn:point positionX="115" positionY="200" />
            <gn:point positionX="45" positionY="200" />
            <gn:point positionX="45" positionY="170" />
            <gn:point positionX="80" positionY="170" />
          </gn:arc>
        </gn:input>
        <gn:input ref="_11_5_3afb06b6_1155040969250_32393_150_LocalMemory">
          <gn:arc>
            <gn:point positionX="105" positionY="140" />
            <gn:point positionX="125" positionY="140" />
            <gn:point positionX="125" positionY="230" />
            <gn:point positionX="35" positionY="230" />
            <gn:point positionX="35" positionY="140" />
            <gn:point positionX="80" positionY="140" />
          </gn:arc>
        </gn:input>
      </gn:inputs>
      <gn:outputs>
        <gn:output ref="_11_5_3afb06b6_1155041130125_346459_182">
          <gn:arc>
            <gn:point positionX="80" positionY="170" />
            <gn:point positionX="95" positionY="170" />
          </gn:arc>
        </gn:output>
        <gn:output ref="_11_5_3afb06b6_1155041142296_276655_193">
          <gn:arc>
            <gn:point positionX="80" positionY="110" />
            <gn:point positionX="95" positionY="110" />
          </gn:arc>
        </gn:output>
        <gn:output ref="_11_5_3afb06b6_1155040969250_32393_150_LocalMemory">
          <gn:arc>
            <gn:point positionX="80" positionY="140" />
            <gn:point positionX="95" positionY="140" />
          </gn:arc>
        </gn:output>
      </gn:outputs>
      <gn:predicates>
        <gn:predicate input="_11_5_3afb06b6_1155040969250_32393_150_LocalMemory" output="_11_5_3afb06b6_1155040969250_32393_150_LocalMemory">true</gn:predicate>
        <gn:predicate input="_11_5_3afb06b6_1155041117734_626168_171" output="_11_5_3afb06b6_1155041130125_346459_182">delay</gn:predicate>
        <gn:predicate input="_11_5_3afb06b6_1155041130125_346459_182" output="_11_5_3afb06b6_1155041142296_276655_193">delay</gn:predicate>
      </gn:predicates>
    </gn:transition>
    <gn:transition id="Parameters" name="Parameters" positionX="220" positionY="130" sizeY="30">
      <gn:inputs>
        <gn:input ref="ParametersPlace">
          <gn:arc>
            <gn:point positionX="245" positionY="140" />
            <gn:point positionX="255" positionY="140" />
            <gn:point positionX="255" positionY="170" />
            <gn:point positionX="185" positionY="170" />
            <gn:point positionX="185" positionY="140" />
            <gn:point positionX="220" positionY="140" />
          </gn:arc>
        </gn:input>
      </gn:inputs>
      <gn:outputs>
        <gn:output ref="ParametersPlace">
          <gn:arc>
            <gn:point positionX="220" positionY="140" />
            <gn:point positionX="235" positionY="140" />
          </gn:arc>
        </gn:output>
      </gn:outputs>
      <gn:predicates />
    </gn:transition>
  </gn:transitions>
  <gn:places>
    <gn:place id="_11_5_3afb06b6_1155040969250_32393_150_LocalMemory" name="Local Memory of vw" char="_11_5_3afb06b6_1155040969250_32393_150_LocalMemory_fun" positionX="100" positionY="140" />
    <gn:place id="_11_5_3afb06b6_1155040964093_303373_131_LocalMemory" name="Local Memory of vp" char="_11_5_3afb06b6_1155040964093_303373_131_LocalMemory_fun" positionX="500" positionY="230" />
    <gn:place id="_11_5_3afb06b6_1155040964093_170047_129_LocalMemory" name="Local Memory of vs" char="_11_5_3afb06b6_1155040964093_170047_129_LocalMemory_fun" positionX="370" positionY="200" />
    <gn:place id="_11_5_3afb06b6_1155041142296_276655_193" name="" char="_11_5_3afb06b6_1155041142296_276655_193_fun" positionX="100" positionY="110" />
    <gn:place id="_11_5_3afb06b6_1155041130125_346459_182" name="show frame" char="_11_5_3afb06b6_1155041130125_346459_182_fun" positionX="100" positionY="170" />
    <gn:place id="_11_5_3afb06b6_1155041117734_626168_171" name="receive frame" char="_11_5_3afb06b6_1155041117734_626168_171_fun" positionX="500" positionY="200" />
    <gn:place id="_11_5_3afb06b6_1155041008937_456743_160" name="send frame" char="_11_5_3afb06b6_1155041008937_456743_160_fun" positionX="370" positionY="170" />
    <gn:place id="_11_5_3afb06b6_1155041001640_595795_154" name="Workload" char="_11_5_3afb06b6_1155041001640_595795_154_fun" positionX="330" positionY="170" />
    <gn:place id="ParametersPlace" name="ParametersPlace" positionX="240" positionY="140" />
  </gn:places>
  <gn:tokens>
    <gn:token id="_11_5_3afb06b6_1155040969250_32393_150_LocalMemory_Token" name="Local Memory of vw Token" host="_11_5_3afb06b6_1155040969250_32393_150_LocalMemory">
      <gn:char name="Default" type="double">1</gn:char>
      <gn:char name="Name" type="string">Local Memory of vw Token</gn:char>
    </gn:token>